commit	win_rate	avg_foundation	status	description
14718bd	0.171200	15.4	keep	Exp 207: depth penalty 0.05->0.07 — +1 wins, same avg_foundation
457b9b0	0.169600	15.3	discard	Exp 208: foundation weight 22->21 — -16 wins, -0.1 avg_foundation
06cb56c	0.000000	0.0	crash	Exp 209: foundation weight 22->23 — orchestration interrupted before evaluation completed
ec4c91e	0.000000	0.0	crash	Exp 210: facedown weight 14->13 — timeout >300s
cfc9f91	0.000000	0.0	crash	Exp 223: auto-play threshold <= 5 -> <= 4 — TIMEOUT >540s
8ebf2c0	0.151000	13.8	discard	Exp 224: shortlist window +2 -> +1 — -93 wins, -0.3 avg_foundation
a000762	0.149200	13.7	discard	Exp 225: shortlist window +2 -> +0 — -111 wins, -0.4 avg_foundation
13d4c97	0.000000	0.0	crash	Exp 226: PREVIEW_CANDIDATES 10 -> 9 — orchestration interrupted before final metrics
b16108e	0.170400	15.3	keep	Exp 253: auto-play threshold best_pri<=5-><=4 - +101 wins, +1.2 avg_foundation
3d83025	0.000000	0.0	crash	Exp 254: auto-play threshold bucket 4->3 - timeout >300s
9859d67	0.161000	15.0	discard	Exp 255: shortlist range 2->1 - -94 wins, -0.3 avg_foundation
0fae964	0.000000	0.0	crash	Exp 256: shortlist range 2->3 - timeout >300s
349c692	0.170400	15.3	discard	Exp 257: PREVIEW_CANDIDATES 10->12 - same wins, same avg_foundation
4b81d35	0.170200	15.3	discard	Exp 258: PREVIEW_CANDIDATES 10->8 - -2 wins, same avg_foundation
210f697	0.170800	15.4	keep	Exp 259: GREEDY_DEPTH 55->60 - +4 wins, +0.1 avg_foundation
c329cdf	0.168700	15.3	discard	Exp 260: GREEDY_DEPTH 60->50 - -21 wins, -0.1 avg_foundation
5765d7d	0.160300	14.8	discard	Exp 261: WASTE_LOOKAHEAD 2->1 - -105 wins, -0.6 avg_foundation
fc9f0ad	0.000000	0.0	crash	Exp 262: WASTE_LOOKAHEAD 2->3 - timeout >300s
49aa508	0.000000	0.0	crash	Exp 263: depth penalty 0.05->0.04 - timeout >300s
3bd9571	0.000000	0.0	crash	Exp 264: auto-play threshold bucket 4->3; shortlist range 2->1 - timeout >300s
db3adbc	0.000000	0.0	crash	Exp 265: auto-play threshold bucket 4->3; shortlist range 2->3 - timeout >300s
01f3a36	0.000000	0.0	crash	Exp 266: auto-play threshold bucket 4->3; PREVIEW_CANDIDATES 10->12 - missing final metrics (BrokenPipeError)
4a5cf4e	0.000000	0.0	crash	Exp 267: auto-play threshold bucket 4->3; WASTE_LOOKAHEAD 2->1 - timeout >300s
930cd82	0.170800	15.4	discard	Exp 268: PREVIEW_CANDIDATES 10->11 - same wins, same avg_foundation
d528397	0.171100	15.4	keep	Exp 269: GREEDY_DEPTH 60->65 - +3 wins, same avg_foundation
d79ebd2	0.171100	15.4	discard	Exp 270: GREEDY_DEPTH 65->70 - same wins, same avg_foundation
7d6b58c	0.171000	15.4	discard	Exp 271: depth penalty 0.05->0.06 - -1 wins, same avg_foundation
a537ba1	0.000000	0.0	crash	Exp 272: depth penalty 0.05->0.07 - timeout >300s
b4a0938	0.169700	15.3	discard	Exp 273: foundation weight 22->21 - -14 wins, -0.1 avg_foundation
e8dbfb8	0.171100	15.4	discard	Exp 274: foundation weight 22->23 - same wins, same avg_foundation
e52ac31	0.169000	15.3	discard	Exp 275: facedown weight 14->13 - -21 wins, -0.1 avg_foundation
89a41c1	0.000000	0.0	crash	Exp 276: facedown weight 14->15 - missing final metrics (BrokenPipeError)
